{
  "id": "corelib-prelude-contracts-fix",
  "title": "Resolve prelude Contracts clash and refresh Diagnostics facade",
  "statusColumn": "Done",
  "priority": "high",
  "workstream": "stabilization",
  "domain": "core-library",
  "completedAt": "2026-05-23",
  "specRelations": [],
  "source": {
    "repo": "corelib",
    "commit": "4b4cd74",
    "subject": "fix(corelib): resolve prelude Contracts clash and refresh Diagnostics facade",
    "url": "https://github.com/Cyber-Nomad-Collective/beskid_standard/commit/4b4cd74"
  },
  "milestoneId": "v03-corelib-tier-ship",
  "body": "Resolves a prelude `Contracts` name clash and refreshes the Diagnostics facade so Tier0 prelude imports compose cleanly.\n\n## Provenance\n- **Repository:** `corelib`\n- **Commit:** [`4b4cd74`](https://github.com/Cyber-Nomad-Collective/beskid_standard/commit/4b4cd74)\n- **Subject:** fix(corelib): resolve prelude Contracts clash and refresh Diagnostics facade\n- **Completed:** 2026-05-23\n\n## Catalog scope\n- **Delivery version:** v0.3 (Macros, concurrency, and stabilization)\n- **Workstream:** `stabilization`\n- **Domain:** `core-library`\n- **Deliverable:** `v03-corelib-tier-ship`\n\n## Relation\nContributes to deliverable **Corelib tier collections ship** (`v03-corelib-tier-ship`).",
  "order": 360,
  "subtasks": [],
  "$schema": "../schemas/seed/task.schema.json"
}
