{
  "id": "corelib-api-shape-standard",
  "title": "Promote corelib-api-shape to Standard with tier pipeline",
  "statusColumn": "Done",
  "priority": "high",
  "workstream": "stabilization",
  "domain": "core-library",
  "completedAt": "2026-05-23",
  "milestoneId": "v03-merge-wave",
  "specRelations": [
    {
      "path": "/platform-spec/core-library/api-shape",
      "title": "API shape",
      "level": "feature",
      "relation": "tracks",
      "required": true
    }
  ],
  "source": {
    "repo": "beskid",
    "commit": "d137f11",
    "subject": "orchestrate(beskid-v0-3): promote corelib-api-shape to Standard with tier pipeline",
    "url": "https://github.com/Cyber-Nomad-Collective/beskid/commit/d137f11"
  },
  "body": "Orchestration promotes the **corelib-api-shape** platform-spec feature to **Standard** and documents the tier tagging pipeline used by publish and coverage gates.\n\n## Platform specification\n\n- **API shape** — `/platform-spec/core-library/api-shape` — *tracks* (required)\n\n## Provenance\n- **Repository:** `beskid`\n- **Commit:** [`d137f11`](https://github.com/Cyber-Nomad-Collective/beskid/commit/d137f11)\n- **Subject:** orchestrate(beskid-v0-3): promote corelib-api-shape to Standard with tier pipeline\n- **Completed:** 2026-05-23\n\n## Catalog scope\n- **Delivery version:** v0.3 (Macros, concurrency, and stabilization)\n- **Workstream:** `stabilization`\n- **Domain:** `core-library`\n- **Deliverable:** `v03-merge-wave`\n\n## Relation\nContributes to deliverable **v0.3 macro/runtime/ffi/tooling delivery** (`v03-merge-wave`). Normative spec: **API shape** (*tracks*).",
  "order": 328,
  "subtasks": [],
  "$schema": "../schemas/seed/task.schema.json"
}
